{"conflicts":[],"continuity_locks":["oval face, shoulder-length black hair with red hairpin on the left","navy wool coat and cream scarf, scarf on left shoulder","small leather notebook in right coat pocket","umbrella is black, matching the previous shot","screen direction stays left-to-right"],"human_review_points":["confirm umbrella color matches previous shot","confirm scarf stays on the left shoulder during the turn"],"main_shot_prompt":"Medium close-up, camera at eye level tracking slightly right as Lin Wan steps under the bookstore awning, folds her black umbrella, and turns toward the shop window; rain continues behind her; 4 seconds; action from walking to a still, resolved gaze; emotion shifts from hurried to determined.","negative_constraints":["no additional characters entering the frame","no new props beyond the umbrella and notebook","no injuries, wet-through clothing, or costume change","no hair restyle or missing hairpin"],"repair_prompt":"Keep every continuity lock and camera position; reroll only Lin Wan's facial expression timing during the turn; nothing else changes.","schema_version":"short_drama_character_consistency_output.v1"}